{
  "schemaVersion": 1,
  "snapshotVersion": "20260930-1958",
  "snapshotSha256": "20290882fadbb68942f2c754262614e0858d8595d06a8b2e970fec1c7b4dfb7b",
  "gateRuleReview": {
    "status": "unverified",
    "reviewer": null,
    "reviewedAt": null,
    "note": null
  },
  "reproduction": {
    "snapshotReplay": {
      "status": "unverified",
      "reviewer": null,
      "reviewedAt": null,
      "note": null
    },
    "modelRerun": {
      "status": "unverified",
      "reviewer": null,
      "reviewedAt": null,
      "note": null
    }
  },
  "records": [
    {
      "modelId": "deepseek-chat",
      "rowIndex": 0,
      "focus": "正常对照",
      "status": "agree",
      "reviewer": {
        "name": "Kk",
        "role": "author"
      },
      "reviewedAt": "2026-10-05",
      "answerReview": {
        "extraction": "complete",
        "refusal": "not_applicable",
        "reason": "AI辅助整理材料，作者核对原始回答、参考答案、检索上下文与机器 Trace 后确认：回答的融资轮次、金额与币种与保存参考答案及检索原文一致；现有陈述覆盖该回答的事实，引用可直接支持，未发现明确遗漏或引用分歧。本条仅限冻结 Demo 快照的定向核验，不推定总体准确率或系统认证。"
      },
      "statementReviews": [
        {
          "statementIndex": 0,
          "humanVerdict": "supported",
          "reason": "作者核对完整回答与检索原文后，认可本条 supported 判定；引用原文可支持该陈述的含义，不要求回答与引用逐字相同。",
          "evidence": "星云科技已累计获得三轮融资，最新一轮B轮融资金额达5亿元人民币。"
        }
      ],
      "reviewDraft": {
        "question": "星云科技最新一轮B轮融资金额是多少？",
        "answerSummary": "星云科技最新一轮B轮融资金额达5亿元人民币。",
        "machineVerdict": {
          "caseType": "positive",
          "faithfulness": 1.0,
          "traceVerdict": "supported",
          "statementCount": 1
        },
        "evidenceLocation": "检索上下文第1条「星云科技已累计获得三轮融资，最新一轮B轮融资金额达5亿元人民币」；标准答案 ground_truth 为「5亿元人民币」。",
        "suggestedChecks": [
          "核对回答金额「5亿元人民币」与上下文表述是否一致",
          "确认唯一语句的 evidence 是否与回答逐字匹配、supported 判定是否成立"
        ]
      }
    },
    {
      "modelId": "deepseek-chat",
      "rowIndex": 2,
      "focus": "正常对照",
      "status": "agree",
      "reviewer": {
        "name": "Kk",
        "role": "author"
      },
      "reviewedAt": "2026-10-05",
      "answerReview": {
        "extraction": "complete",
        "refusal": "not_applicable",
        "reason": "AI辅助整理材料，作者核对原始回答、参考答案、检索上下文与机器 Trace 后确认：回答中的三项核心特性及说明与保存参考答案和检索原文一致；三条机器陈述覆盖主要事实，各自引用对应原文，未发现明确遗漏或引用分歧。本条仅限冻结 Demo 快照的定向核验，不推定总体准确率或系统认证。"
      },
      "statementReviews": [
        {
          "statementIndex": 0,
          "humanVerdict": "supported",
          "reason": "作者核对完整回答与检索原文后，认可本条 supported 判定；引用原文可支持该陈述的含义，不要求回答与引用逐字相同。",
          "evidence": "星语产品具备三大核心特性：一是多轮对话能力，能够结合上下文理解用户意图"
        },
        {
          "statementIndex": 1,
          "humanVerdict": "supported",
          "reason": "作者核对完整回答与检索原文后，认可本条 supported 判定；引用原文可支持该陈述的含义，不要求回答与引用逐字相同。",
          "evidence": "二是知识库挂载，支持企业上传私有文档构建专属问答库"
        },
        {
          "statementIndex": 2,
          "humanVerdict": "supported",
          "reason": "作者核对完整回答与检索原文后，认可本条 supported 判定；引用原文可支持该陈述的含义，不要求回答与引用逐字相同。",
          "evidence": "三是权限管控，可根据部门与角色设置数据访问范围"
        }
      ],
      "reviewDraft": {
        "question": "星语产品具备哪三大核心特性？",
        "answerSummary": "多轮对话能力、知识库挂载、权限管控三大特性（与标准答案一致）。",
        "machineVerdict": {
          "caseType": "positive",
          "faithfulness": 1.0,
          "traceVerdict": "supported",
          "statementCount": 3
        },
        "evidenceLocation": "上下文第1条「星语产品具备三大核心特性：一是多轮对话能力…二是知识库挂载…三是权限管控…」。",
        "suggestedChecks": [
          "逐条核对三大特性是否与原文一致、有无遗漏或增补",
          "三条语句的 evidence 是否各自指向对应特性原文"
        ]
      }
    },
    {
      "modelId": "deepseek-chat",
      "rowIndex": 3,
      "focus": "空 Trace 检查",
      "status": "uncertain",
      "reviewer": {
        "name": "Kk",
        "role": "author"
      },
      "reviewedAt": "2026-10-05",
      "answerReview": {
        "extraction": "uncertain",
        "refusal": "reasonable",
        "reason": "AI辅助整理材料，作者核对原始回答、参考答案、检索上下文与机器 Trace 后确认：当前检索材料未提供 XH-2024 审计批次的具体幻觉段落定位结果，拒答与保存参考答案相符，在现有材料范围内合理。但原 Trace 为空，缺少逐句处理过程和历史裁判规则，无法确认属于预期拒答处理、抽取或记录问题。无法确认的是证据链处理完整性，不是拒答合理性；Faithfulness=null 不作为无幻觉证明，也不解释其缺失原因。本条仅限冻结 Demo 快照的定向核验，不推定总体准确率或系统认证。"
      },
      "statementReviews": [],
      "reviewDraft": {
        "question": "星语验证器在2024年发布时，针对编号「XH-2024」的金融行业审计批次，记录了哪些具体的幻觉段落定位结果？",
        "answerSummary": "根据提供的文档，无法回答该问题。",
        "machineVerdict": {
          "caseType": "negative",
          "faithfulness": null,
          "traceVerdict": "empty",
          "statementCount": 0
        },
        "evidenceLocation": "hallucination_trace 为 {\"statements\": []}；上下文中不存在「XH-2024」相关信息。",
        "suggestedChecks": [
          "确认这是负样本（文档未提及 XH-2024），拒答是否合理",
          "空 Trace 应理解为「拒答本就无语句可抽取」还是「抽取遗漏」，需人工判断",
          "faithfulness 为 null（无逐句判定）是否应视为正确拒答而非漏判"
        ]
      }
    },
    {
      "modelId": "deepseek-chat",
      "rowIndex": 4,
      "focus": "空 Trace 检查",
      "status": "uncertain",
      "reviewer": {
        "name": "Kk",
        "role": "author"
      },
      "reviewedAt": "2026-10-05",
      "answerReview": {
        "extraction": "uncertain",
        "refusal": "reasonable",
        "reason": "AI辅助整理材料，作者核对原始回答、参考答案、检索上下文与机器 Trace 后确认：当前检索材料有通用时延描述，但未提供“仁和医疗集团”指定实例的实测数据，拒答与保存参考答案相符，在现有材料范围内合理。但原 Trace 为空，缺少逐句处理过程和历史裁判规则，无法确认属于预期拒答处理、抽取或记录问题。无法确认的是证据链处理完整性，不是拒答合理性；Faithfulness=null 不作为无幻觉证明，也不解释其缺失原因。本条仅限冻结 Demo 快照的定向核验，不推定总体准确率或系统认证。"
      },
      "statementReviews": [],
      "reviewDraft": {
        "question": "星语产品在医疗行业落地时，与「仁和医疗集团」合作部署的私有化实例，其单卡推理时延实测数据是多少？",
        "answerSummary": "根据提供的文档，无法回答该问题。",
        "machineVerdict": {
          "caseType": "negative",
          "faithfulness": null,
          "traceVerdict": "empty",
          "statementCount": 0
        },
        "evidenceLocation": "hallucination_trace 为 {\"statements\": []}；上下文有「星语单卡推理时延控制在200毫秒以内」但无「仁和医疗集团」的实测数据。",
        "suggestedChecks": [
          "拒答是否合理（问题索要文档未提及的具体实测数据）",
          "空 Trace 与 faithfulness=null 是否应视为「无幻觉、正确拒答」而非「未抽取」"
        ]
      }
    },
    {
      "modelId": "deepseek-chat",
      "rowIndex": 5,
      "focus": "空 Trace 检查",
      "status": "uncertain",
      "reviewer": {
        "name": "Kk",
        "role": "author"
      },
      "reviewedAt": "2026-10-05",
      "answerReview": {
        "extraction": "uncertain",
        "refusal": "reasonable",
        "reason": "AI辅助整理材料，作者核对原始回答、参考答案、检索上下文与机器 Trace 后确认：当前检索材料未提供阈值调整为0.85时对应的金融领域准确率变化数据，拒答与保存参考答案相符，在现有材料范围内合理。但原 Trace 为空，缺少逐句处理过程和历史裁判规则，无法确认属于预期拒答处理、抽取或记录问题。无法确认的是证据链处理完整性，不是拒答合理性；Faithfulness=null 不作为无幻觉证明，也不解释其缺失原因。本条仅限冻结 Demo 快照的定向核验，不推定总体准确率或系统认证。"
      },
      "statementReviews": [],
      "reviewDraft": {
        "question": "如果星语验证器的忠实度检测引擎将比对阈值从默认值调整为0.85，在金融领域测试中回答准确率会变化多少？",
        "answerSummary": "根据提供的文档，无法回答该问题。",
        "machineVerdict": {
          "caseType": "negative",
          "faithfulness": null,
          "traceVerdict": "empty",
          "statementCount": 0
        },
        "evidenceLocation": "hallucination_trace 为 {\"statements\": []}；上下文无「阈值0.85→准确率变化」的因果数据。",
        "suggestedChecks": [
          "拒答是否合理（假设性问题、文档无此数据）",
          "空 Trace + null faithfulness 的判定语义需人工确认"
        ]
      }
    },
    {
      "modelId": "Pro/Qwen/Qwen2.5-7B-Instruct",
      "rowIndex": 2,
      "focus": "抽取遗漏检查",
      "status": "disagree",
      "reviewer": {
        "name": "Kk",
        "role": "author"
      },
      "reviewedAt": "2026-10-05",
      "answerReview": {
        "extraction": "missing",
        "refusal": "not_applicable",
        "reason": "AI辅助整理材料，作者核对原始回答、参考答案、检索上下文与机器 Trace 后确认：回答包含三项可核对的核心特性，与保存参考答案及检索原文一致，但保存的 Trace 为空，未覆盖这些实质性事实。分歧针对逐句证据链的覆盖缺失，不认定必须抽取恰好三句，不推断抽取环节漏跑，也不由此推定 Faithfulness 计算错误。本条仅限冻结 Demo 快照的定向核验，不推定总体准确率或系统认证。"
      },
      "statementReviews": [],
      "reviewDraft": {
        "question": "星语产品具备哪三大核心特性？",
        "answerSummary": "完整列出三大核心特性（多轮对话能力 / 知识库挂载 / 权限管控），内容与标准答案一致。",
        "machineVerdict": {
          "caseType": "positive",
          "faithfulness": 1.0,
          "traceVerdict": "empty",
          "statementCount": 0
        },
        "evidenceLocation": "上下文第1条明确包含三大特性原文；但 hallucination_trace 为 {\"statements\": []}（本应有 3 条 supported 却为 0 条）。",
        "suggestedChecks": [
          "核心样本：回答正确完整但 Trace 为空，疑似逐句抽取遗漏（应 3 条 supported 却 0 条）",
          "faithfulness=1.0 与空 Trace 并存是否矛盾，需确认抽取环节是否漏跑",
          "对比 deepseek 与 glm 同题（均有 3 条 supported），确认 Qwen 为何无语句"
        ]
      }
    },
    {
      "modelId": "Pro/Qwen/Qwen2.5-7B-Instruct",
      "rowIndex": 3,
      "focus": "拒答判定检查",
      "status": "disagree",
      "reviewer": {
        "name": "Kk",
        "role": "author"
      },
      "reviewedAt": "2026-10-05",
      "answerReview": {
        "extraction": "complete",
        "refusal": "reasonable",
        "reason": "AI辅助整理材料，作者核对原始回答、参考答案、检索上下文与机器 Trace 后确认：当前检索材料未提供 XH-2024 审计批次的具体定位结果，保存参考答案为“文档未提及”，拒答在该材料范围内合理。对将其材料不足说明归为 fabrication 存在分歧；该说明按拒答处理核对，不作为新增业务事实判定。未核对完整文档或历史裁判提示词，不宣称算法错误，也不推定 Trace 标签造成保存分数变化。本条仅限冻结 Demo 快照的定向核验，不推定总体准确率或系统认证。"
      },
      "statementReviews": [
        {
          "statementIndex": 0,
          "humanVerdict": "not_applicable",
          "reason": "本句是检索材料不足的拒答说明，按拒答适用性检查，不作为新增业务事实使用 fabrication 类别判断。当前上下文与保存参考答案支持拒答合理性，但不证明完整文档不存在该信息；空引用本身不能证明编造。不适用仅指该句的业务事实分类，保留原机器标签。",
          "evidence": null
        }
      ],
      "reviewDraft": {
        "question": "星语验证器在2024年发布时，针对编号「XH-2024」的金融行业审计批次，记录了哪些具体的幻觉段落定位结果？",
        "answerSummary": "根据提供的文档，无法回答该问题。文档中没有提及编号为「XH-2024」的金融行业审计批次的具体幻觉段落定位结果。",
        "machineVerdict": {
          "caseType": "negative",
          "faithfulness": 0.0,
          "traceVerdict": "fabrication",
          "statementCount": 1
        },
        "evidenceLocation": "唯一语句「文档中没有提及编号为XH-2024的…」被判 fabrication，evidence 为空字符串；上下文中确实不存在 XH-2024。",
        "suggestedChecks": [
          "重点：拒答的补充解释句（文档确实没提及）被判 fabrication 是否为误判——该句是正确陈述，并非无依据编造",
          "evidence 为空是 fabrication 的标记，但拒答句本就无需引用证据，需人工确认判定是否成立",